{
  "$schema": "https://json-schema.org/draft/2020-12/schema",
  "$id": "public-suites-allowlist.schema.json",
  "title": "Public eval suites allowlist",
  "description": "Decides which raw eval suites in gs://guidance-evals are rebuilt into the public dashboard. Changed by pull request only. This schema is enforced by src/harness/public/allowlist.ts at load time; the one rule it cannot express (wildcard include patterns must start with nightly-) is checked there too.",
  "type": "object",
  "additionalProperties": false,
  "required": ["include", "exclude", "overrides", "releasedModels"],
  "properties": {
    "$schema": { "type": "string" },
    "include": {
      "description": "Suite IDs or glob patterns (* and ? only) that are eligible for publishing, e.g. nightly-*-codex_cli.",
      "type": "array",
      "items": { "type": "string", "pattern": "^\\S+$" },
      "uniqueItems": true
    },
    "exclude": {
      "description": "Exact suite IDs that must not be published even if they match include.",
      "type": "array",
      "items": { "type": "string", "pattern": "^[^*?\\s]+$" },
      "uniqueItems": true
    },
    "overrides": {
      "description": "Per-suite guide-level exclusions.",
      "type": "array",
      "items": {
        "type": "object",
        "additionalProperties": false,
        "required": ["id", "excludeGuides"],
        "properties": {
          "id": { "type": "string", "pattern": "^[^*?\\s]+$" },
          "excludeGuides": {
            "type": "array",
            "items": { "type": "string", "pattern": "^\\S+$" },
            "minItems": 1,
            "uniqueItems": true
          }
        }
      }
    },
    "releasedModels": {
      "description": "Model identifiers (as recorded in evals.json#model) that may appear publicly. Empty means nothing publishes.",
      "type": "array",
      "items": { "type": "string", "pattern": "^\\S+$" },
      "uniqueItems": true
    },
    "retention": {
      "description": "How much history stays published. Older or surplus suites are dropped from the public copy on the next build; their raw data is untouched.",
      "type": "object",
      "additionalProperties": false,
      "properties": {
        "maxAgeDays": { "type": "integer", "minimum": 1, "description": "Drop suites whose raw evals.json is older than this many days." },
        "maxSuites": { "type": "integer", "minimum": 1, "description": "Keep at most this many of the newest suites." }
      }
    }
  }
}
